bench/results_kernelbench_mega_w4a16_rkv_4090_20260711.jsonl
{"axis": "kernelbench_mega_w4a16_rkv", "backend": "hf_adapter", "status": "pass", "candidate_backend": "triton_int4_projection_axis_rkv", "device": "NVIDIA GeForce RTX 4090", "dtype": "fp16", "batch_size": 1, "hidden_size": 1024, "layers": [0, 1, 11], "warmup": 16, "steps": 512, "avg_fp16_ms": 0.036349, "best_current_fused": {"block_m": 8, "block_k": 128, "num_warps": 4, "avg_ms": 0.068418, "min_cosine_vs_fp16": 0.982979416847229}, "best_stacked_prepacked": {"block_m": 32, "block_k": 64, "num_warps": 4, "avg_ms": 0.039686, "max_abs_diff_vs_current_w4": 0.0, "min_cosine_vs_fp16": 0.982979416847229}, "stacked_prepacked_speedup_vs_current": 1.724, "stacked_prepacked_speedup_vs_fp16": 0.9159, "stacked_runtime_copy_ms": 0.055763, "stacked_runtime_copy_speedup_vs_current": 1.2269, "stacked_runtime_copy_speedup_vs_fp16": 0.6519, "packed_footprint_ratio_vs_fp16": 0.252, "kernel_launches": {"current_fused": 1, "stacked_prepacked": 1, "stacked_runtime_copy": 2}, "current_configs": [{"block_m": 8, "block_k": 32, "num_warps": 4, "avg_ms": 0.071662, "min_cosine_vs_fp16": 0.982979416847229}, {"block_m": 8, "block_k": 64, "num_warps": 4, "avg_ms": 0.072256, "min_cosine_vs_fp16": 0.982979416847229}, {"block_m": 8, "block_k": 128, "num_warps": 4, "avg_ms": 0.068418, "min_cosine_vs_fp16": 0.982979416847229}, {"block_m": 8, "block_k": 256, "num_warps": 4, "avg_ms": 0.071501, "min_cosine_vs_fp16": 0.982979416847229}, {"block_m": 16, "block_k": 32, "num_warps": 4, "avg_ms": 0.06987, "min_cosine_vs_fp16": 0.982979416847229}, {"block_m": 16, "block_k": 64, "num_warps": 4, "avg_ms": 0.071618, "min_cosine_vs_fp16": 0.982979416847229}, {"block_m": 16, "block_k": 128, "num_warps": 4, "avg_ms": 0.070985, "min_cosine_vs_fp16": 0.982979416847229}, {"block_m": 16, "block_k": 256, "num_warps": 4, "avg_ms": 0.070243, "min_cosine_vs_fp16": 0.982979416847229}, {"block_m": 32, "block_k": 32, "num_warps": 4, "avg_ms": 0.069948, "min_cosine_vs_fp16": 0.982979416847229}, {"block_m": 32, "block_k": 64, "num_warps": 4, "avg_ms": 0.0712, "min_cosine_vs_fp16": 0.982979416847229}, {"block_m": 32, "block_k": 128, "num_warps": 4, "avg_ms": 0.068937, "min_cosine_vs_fp16": 0.982979416847229}, {"block_m": 32, "block_k": 256, "num_warps": 4, "avg_ms": 0.070732, "min_cosine_vs_fp16": 0.982979416847229}, {"block_m": 64, "block_k": 32, "num_warps": 4, "avg_ms": 0.071355, "min_cosine_vs_fp16": 0.982979416847229}, {"block_m": 64, "block_k": 64, "num_warps": 4, "avg_ms": 0.069508, "min_cosine_vs_fp16": 0.982979416847229}, {"block_m": 64, "block_k": 128, "num_warps": 4, "avg_ms": 0.071299, "min_cosine_vs_fp16": 0.982979416847229}, {"block_m": 64, "block_k": 256, "num_warps": 4, "avg_ms": 0.143019, "min_cosine_vs_fp16": 0.982979416847229}], "stacked_configs": [{"block_m": 8, "block_k": 32, "num_warps": 1, "avg_ms": 0.043668, "max_abs_diff_vs_current_w4": 0.0, "min_cosine_vs_fp16": 0.982979416847229}, {"block_m": 8, "block_k": 32, "num_warps": 2, "avg_ms": 0.043121, "max_abs_diff_vs_current_w4": 0.0, "min_cosine_vs_fp16": 0.982979416847229}, {"block_m": 8, "block_k": 32, "num_warps": 4, "avg_ms": 0.047328, "max_abs_diff_vs_current_w4": 0.0, "min_cosine_vs_fp16": 0.982979416847229}, {"block_m": 8, "block_k": 32, "num_warps": 8, "avg_ms": 0.044238, "max_abs_diff_vs_current_w4": 0.0, "min_cosine_vs_fp16": 0.982979416847229}, {"block_m": 8, "block_k": 64, "num_warps": 1, "avg_ms": 0.040085, "max_abs_diff_vs_current_w4": 0.0, "min_cosine_vs_fp16": 0.982979416847229}, {"block_m": 8, "block_k": 64, "num_warps": 2, "avg_ms": 0.042061, "max_abs_diff_vs_current_w4": 0.0, "min_cosine_vs_fp16": 0.982979416847229}, {"block_m": 8, "block_k": 64, "num_warps": 4, "avg_ms": 0.041658, "max_abs_diff_vs_current_w4": 0.0, "min_cosine_vs_fp16": 0.982979416847229}, {"block_m": 8, "block_k": 64, "num_warps": 8, "avg_ms": 0.042379, "max_abs_diff_vs_current_w4": 0.0, "min_cosine_vs_fp16": 0.982979416847229}, {"block_m": 8, "block_k": 128, "num_warps": 1, "avg_ms": 0.041807, "max_abs_diff_vs_current_w4": 0.0, "min_cosine_vs_fp16": 0.982979416847229}, {"block_m": 8, "block_k": 128, "num_warps": 2, "avg_ms": 0.041164, "max_abs_diff_vs_current_w4": 0.0, "min_cosine_vs_fp16": 0.982979416847229}, {"block_m": 8, "block_k": 128, "num_warps": 4, "avg_ms": 0.040723, "max_abs_diff_vs_current_w4": 0.0, "min_cosine_vs_fp16": 0.982979416847229}, {"block_m": 8, "block_k": 128, "num_warps": 8, "avg_ms": 0.042242, "max_abs_diff_vs_current_w4": 0.0, "min_cosine_vs_fp16": 0.982979416847229}, {"block_m": 8, "block_k": 256, "num_warps": 1, "avg_ms": 0.042282, "max_abs_diff_vs_current_w4": 0.0, "min_cosine_vs_fp16": 0.982979416847229}, {"block_m": 8, "block_k": 256, "num_warps": 2, "avg_ms": 0.042399, "max_abs_diff_vs_current_w4": 0.0, "min_cosine_vs_fp16": 0.982979416847229}, {"block_m": 8, "block_k": 256, "num_warps": 4, "avg_ms": 0.041598, "max_abs_diff_vs_current_w4": 0.0, "min_cosine_vs_fp16": 0.982979416847229}, {"block_m": 8, "block_k": 256, "num_warps": 8, "avg_ms": 0.040178, "max_abs_diff_vs_current_w4": 0.0, "min_cosine_vs_fp16": 0.982979416847229}, {"block_m": 16, "block_k": 32, "num_warps": 1, "avg_ms": 0.041718, "max_abs_diff_vs_current_w4": 0.0, "min_cosine_vs_fp16": 0.982979416847229}, {"block_m": 16, "block_k": 32, "num_warps": 2, "avg_ms": 0.04153, "max_abs_diff_vs_current_w4": 0.0, "min_cosine_vs_fp16": 0.982979416847229}, {"block_m": 16, "block_k": 32, "num_warps": 4, "avg_ms": 0.04227, "max_abs_diff_vs_current_w4": 0.0, "min_cosine_vs_fp16": 0.982979416847229}, {"block_m": 16, "block_k": 32, "num_warps": 8, "avg_ms": 0.041246, "max_abs_diff_vs_current_w4": 0.0, "min_cosine_vs_fp16": 0.982979416847229}, {"block_m": 16, "block_k": 64, "num_warps": 1, "avg_ms": 0.041161, "max_abs_diff_vs_current_w4": 0.0, "min_cosine_vs_fp16": 0.982979416847229}, {"block_m": 16, "block_k": 64, "num_warps": 2, "avg_ms": 0.041149, "max_abs_diff_vs_current_w4": 0.0, "min_cosine_vs_fp16": 0.982979416847229}, {"block_m": 16, "block_k": 64, "num_warps": 4, "avg_ms": 0.041177, "max_abs_diff_vs_current_w4": 0.0, "min_cosine_vs_fp16": 0.982979416847229}, {"block_m": 16, "block_k": 64, "num_warps": 8, "avg_ms": 0.04073, "max_abs_diff_vs_current_w4": 0.0, "min_cosine_vs_fp16": 0.982979416847229}, {"block_m": 16, "block_k": 128, "num_warps": 1, "avg_ms": 0.041437, "max_abs_diff_vs_current_w4": 0.0, "min_cosine_vs_fp16": 0.982979416847229}, {"block_m": 16, "block_k": 128, "num_warps": 2, "avg_ms": 0.041614, "max_abs_diff_vs_current_w4": 0.0, "min_cosine_vs_fp16": 0.982979416847229}, {"block_m": 16, "block_k": 128, "num_warps": 4, "avg_ms": 0.041602, "max_abs_diff_vs_current_w4": 0.0, "min_cosine_vs_fp16": 0.982979416847229}, {"block_m": 16, "block_k": 128, "num_warps": 8, "avg_ms": 0.041364, "max_abs_diff_vs_current_w4": 0.0, "min_cosine_vs_fp16": 0.982979416847229}, {"block_m": 16, "block_k": 256, "num_warps": 1, "avg_ms": 0.041195, "max_abs_diff_vs_current_w4": 0.0, "min_cosine_vs_fp16": 0.982979416847229}, {"block_m": 16, "block_k": 256, "num_warps": 2, "avg_ms": 0.040767, "max_abs_diff_vs_current_w4": 0.0, "min_cosine_vs_fp16": 0.982979416847229}, {"block_m": 16, "block_k": 256, "num_warps": 4, "avg_ms": 0.041951, "max_abs_diff_vs_current_w4": 0.0, "min_cosine_vs_fp16": 0.982979416847229}, {"block_m": 16, "block_k": 256, "num_warps": 8, "avg_ms": 0.04105, "max_abs_diff_vs_current_w4": 0.0, "min_cosine_vs_fp16": 0.982979416847229}, {"block_m": 32, "block_k": 32, "num_warps": 1, "avg_ms": 0.042273, "max_abs_diff_vs_current_w4": 0.0, "min_cosine_vs_fp16": 0.982979416847229}, {"block_m": 32, "block_k": 32, "num_warps": 2, "avg_ms": 0.04113, "max_abs_diff_vs_current_w4": 0.0, "min_cosine_vs_fp16": 0.982979416847229}, {"block_m": 32, "block_k": 32, "num_warps": 4, "avg_ms": 0.04173, "max_abs_diff_vs_current_w4": 0.0, "min_cosine_vs_fp16": 0.982979416847229}, {"block_m": 32, "block_k": 32, "num_warps": 8, "avg_ms": 0.040303, "max_abs_diff_vs_current_w4": 0.0, "min_cosine_vs_fp16": 0.982979416847229}, {"block_m": 32, "block_k": 64, "num_warps": 1, "avg_ms": 0.041351, "max_abs_diff_vs_current_w4": 0.0, "min_cosine_vs_fp16": 0.982979416847229}, {"block_m": 32, "block_k": 64, "num_warps": 2, "avg_ms": 0.041712, "max_abs_diff_vs_current_w4": 0.0, "min_cosine_vs_fp16": 0.982979416847229}, {"block_m": 32, "block_k": 64, "num_warps": 4, "avg_ms": 0.039686, "max_abs_diff_vs_current_w4": 0.0, "min_cosine_vs_fp16": 0.982979416847229}, {"block_m": 32, "block_k": 64, "num_warps": 8, "avg_ms": 0.04093, "max_abs_diff_vs_current_w4": 0.0, "min_cosine_vs_fp16": 0.982979416847229}, {"block_m": 32, "block_k": 128, "num_warps": 1, "avg_ms": 0.040168, "max_abs_diff_vs_current_w4": 0.0, "min_cosine_vs_fp16": 0.982979416847229}, {"block_m": 32, "block_k": 128, "num_warps": 2, "avg_ms": 0.041137, "max_abs_diff_vs_current_w4": 0.0, "min_cosine_vs_fp16": 0.982979416847229}, {"block_m": 32, "block_k": 128, "num_warps": 4, "avg_ms": 0.04173, "max_abs_diff_vs_current_w4": 0.0, "min_cosine_vs_fp16": 0.982979416847229}, {"block_m": 32, "block_k": 128, "num_warps": 8, "avg_ms": 0.042546, "max_abs_diff_vs_current_w4": 0.0, "min_cosine_vs_fp16": 0.982979416847229}, {"block_m": 32, "block_k": 256, "num_warps": 1, "avg_ms": 0.042884, "max_abs_diff_vs_current_w4": 0.0, "min_cosine_vs_fp16": 0.982979416847229}, {"block_m": 32, "block_k": 256, "num_warps": 2, "avg_ms": 0.043278, "max_abs_diff_vs_current_w4": 0.0, "min_cosine_vs_fp16": 0.982979416847229}, {"block_m": 32, "block_k": 256, "num_warps": 4, "avg_ms": 0.042491, "max_abs_diff_vs_current_w4": 0.0, "min_cosine_vs_fp16": 0.982979416847229}, {"block_m": 32, "block_k": 256, "num_warps": 8, "avg_ms": 0.042764, "max_abs_diff_vs_current_w4": 0.0, "min_cosine_vs_fp16": 0.982979416847229}, {"block_m": 64, "block_k": 32, "num_warps": 1, "avg_ms": 0.042281, "max_abs_diff_vs_current_w4": 0.0, "min_cosine_vs_fp16": 0.982979416847229}, {"block_m": 64, "block_k": 32, "num_warps": 2, "avg_ms": 0.042784, "max_abs_diff_vs_current_w4": 0.0, "min_cosine_vs_fp16": 0.982979416847229}, {"block_m": 64, "block_k": 32, "num_warps": 4, "avg_ms": 0.043078, "max_abs_diff_vs_current_w4": 0.0, "min_cosine_vs_fp16": 0.982979416847229}, {"block_m": 64, "block_k": 32, "num_warps": 8, "avg_ms": 0.04329, "max_abs_diff_vs_current_w4": 0.0, "min_cosine_vs_fp16": 0.982979416847229}, {"block_m": 64, "block_k": 64, "num_warps": 1, "avg_ms": 0.042503, "max_abs_diff_vs_current_w4": 0.0, "min_cosine_vs_fp16": 0.982979416847229}, {"block_m": 64, "block_k": 64, "num_warps": 2, "avg_ms": 0.04363, "max_abs_diff_vs_current_w4": 0.0, "min_cosine_vs_fp16": 0.982979416847229}, {"block_m": 64, "block_k": 64, "num_warps": 4, "avg_ms": 0.043634, "max_abs_diff_vs_current_w4": 0.0, "min_cosine_vs_fp16": 0.982979416847229}, {"block_m": 64, "block_k": 64, "num_warps": 8, "avg_ms": 0.043504, "max_abs_diff_vs_current_w4": 0.0, "min_cosine_vs_fp16": 0.982979416847229}, {"block_m": 64, "block_k": 128, "num_warps": 1, "avg_ms": 0.041625, "max_abs_diff_vs_current_w4": 0.0, "min_cosine_vs_fp16": 0.982979416847229}, {"block_m": 64, "block_k": 128, "num_warps": 2, "avg_ms": 0.043149, "max_abs_diff_vs_current_w4": 0.0, "min_cosine_vs_fp16": 0.982979416847229}, {"block_m": 64, "block_k": 128, "num_warps": 4, "avg_ms": 0.058475, "max_abs_diff_vs_current_w4": 0.0, "min_cosine_vs_fp16": 0.982979416847229}, {"block_m": 64, "block_k": 128, "num_warps": 8, "avg_ms": 0.041907, "max_abs_diff_vs_current_w4": 0.0, "min_cosine_vs_fp16": 0.982979416847229}, {"block_m": 64, "block_k": 256, "num_warps": 1, "avg_ms": 0.081732, "max_abs_diff_vs_current_w4": 0.0, "min_cosine_vs_fp16": 0.982979416847229}, {"block_m": 64, "block_k": 256, "num_warps": 2, "avg_ms": 0.041037, "max_abs_diff_vs_current_w4": 0.0, "min_cosine_vs_fp16": 0.982979416847229}, {"block_m": 64, "block_k": 256, "num_warps": 4, "avg_ms": 0.041345, "max_abs_diff_vs_current_w4": 0.0, "min_cosine_vs_fp16": 0.982979416847229}, {"block_m": 64, "block_k": 256, "num_warps": 8, "avg_ms": 0.04307, "max_abs_diff_vs_current_w4": 0.0, "min_cosine_vs_fp16": 0.982979416847229}], "peak_vram_mb": 887.0}
{"axis": "kernelbench_mega_w4a16_rkv", "backend": "hf_adapter", "status": "pass", "candidate_backend": "triton_int4_projection_axis_rkv", "device": "NVIDIA GeForce RTX 4090", "dtype": "fp16", "batch_size": 2, "hidden_size": 1024, "layers": [0, 1, 11], "warmup": 16, "steps": 512, "avg_fp16_ms": 0.039633, "best_current_fused": {"block_m": 32, "block_k": 32, "num_warps": 4, "avg_ms": 0.067992, "min_cosine_vs_fp16": 0.9799467325210571}, "best_stacked_prepacked": {"block_m": 64, "block_k": 32, "num_warps": 2, "avg_ms": 0.039239, "max_abs_diff_vs_current_w4": 0.0, "min_cosine_vs_fp16": 0.9799467325210571}, "stacked_prepacked_speedup_vs_current": 1.7328, "stacked_prepacked_speedup_vs_fp16": 1.0101, "stacked_runtime_copy_ms": 0.055204, "stacked_runtime_copy_speedup_vs_current": 1.2316, "stacked_runtime_copy_speedup_vs_fp16": 0.7179, "packed_footprint_ratio_vs_fp16": 0.252, "kernel_launches": {"current_fused": 1, "stacked_prepacked": 1, "stacked_runtime_copy": 2}, "current_configs": [{"block_m": 8, "block_k": 32, "num_warps": 4, "avg_ms": 0.069488, "min_cosine_vs_fp16": 0.9799467325210571}, {"block_m": 8, "block_k": 64, "num_warps": 4, "avg_ms": 0.070606, "min_cosine_vs_fp16": 0.9799467325210571}, {"block_m": 8, "block_k": 128, "num_warps": 4, "avg_ms": 0.068891, "min_cosine_vs_fp16": 0.9799467325210571}, {"block_m": 8, "block_k": 256, "num_warps": 4, "avg_ms": 0.068775, "min_cosine_vs_fp16": 0.9799467325210571}, {"block_m": 16, "block_k": 32, "num_warps": 4, "avg_ms": 0.068977, "min_cosine_vs_fp16": 0.9799467325210571}, {"block_m": 16, "block_k": 64, "num_warps": 4, "avg_ms": 0.068012, "min_cosine_vs_fp16": 0.9799467325210571}, {"block_m": 16, "block_k": 128, "num_warps": 4, "avg_ms": 0.069865, "min_cosine_vs_fp16": 0.9799467325210571}, {"block_m": 16, "block_k": 256, "num_warps": 4, "avg_ms": 0.068319, "min_cosine_vs_fp16": 0.9799467325210571}, {"block_m": 32, "block_k": 32, "num_warps": 4, "avg_ms": 0.067992, "min_cosine_vs_fp16": 0.9799467325210571}, {"block_m": 32, "block_k": 64, "num_warps": 4, "avg_ms": 0.068811, "min_cosine_vs_fp16": 0.9799467325210571}, {"block_m": 32, "block_k": 128, "num_warps": 4, "avg_ms": 0.068743, "min_cosine_vs_fp16": 0.9799467325210571}, {"block_m": 32, "block_k": 256, "num_warps": 4, "avg_ms": 0.06914, "min_cosine_vs_fp16": 0.9799467325210571}, {"block_m": 64, "block_k": 32, "num_warps": 4, "avg_ms": 0.068591, "min_cosine_vs_fp16": 0.9799467325210571}, {"block_m": 64, "block_k": 64, "num_warps": 4, "avg_ms": 0.068042, "min_cosine_vs_fp16": 0.9799467325210571}, {"block_m": 64, "block_k": 128, "num_warps": 4, "avg_ms": 0.068811, "min_cosine_vs_fp16": 0.9799467325210571}, {"block_m": 64, "block_k": 256, "num_warps": 4, "avg_ms": 0.114604, "min_cosine_vs_fp16": 0.9799467325210571}], "stacked_configs": [{"block_m": 8, "block_k": 32, "num_warps": 1, "avg_ms": 0.043038, "max_abs_diff_vs_current_w4": 0.0, "min_cosine_vs_fp16": 0.9799467325210571}, {"block_m": 8, "block_k": 32, "num_warps": 2, "avg_ms": 0.041616, "max_abs_diff_vs_current_w4": 0.0, "min_cosine_vs_fp16": 0.9799467325210571}, {"block_m": 8, "block_k": 32, "num_warps": 4, "avg_ms": 0.041662, "max_abs_diff_vs_current_w4": 0.0, "min_cosine_vs_fp16": 0.9799467325210571}, {"block_m": 8, "block_k": 32, "num_warps": 8, "avg_ms": 0.041735, "max_abs_diff_vs_current_w4": 0.0, "min_cosine_vs_fp16": 0.9799467325210571}, {"block_m": 8, "block_k": 64, "num_warps": 1, "avg_ms": 0.040242, "max_abs_diff_vs_current_w4": 0.0, "min_cosine_vs_fp16": 0.9799467325210571}, {"block_m": 8, "block_k": 64, "num_warps": 2, "avg_ms": 0.043934, "max_abs_diff_vs_current_w4": 0.0, "min_cosine_vs_fp16": 0.9799467325210571}, {"block_m": 8, "block_k": 64, "num_warps": 4, "avg_ms": 0.04082, "max_abs_diff_vs_current_w4": 0.0, "min_cosine_vs_fp16": 0.9799467325210571}, {"block_m": 8, "block_k": 64, "num_warps": 8, "avg_ms": 0.044319, "max_abs_diff_vs_current_w4": 0.0, "min_cosine_vs_fp16": 0.9799467325210571}, {"block_m": 8, "block_k": 128, "num_warps": 1, "avg_ms": 0.042733, "max_abs_diff_vs_current_w4": 0.0, "min_cosine_vs_fp16": 0.9799467325210571}, {"block_m": 8, "block_k": 128, "num_warps": 2, "avg_ms": 0.039757, "max_abs_diff_vs_current_w4": 0.0, "min_cosine_vs_fp16": 0.9799467325210571}, {"block_m": 8, "block_k": 128, "num_warps": 4, "avg_ms": 0.04248, "max_abs_diff_vs_current_w4": 0.0, "min_cosine_vs_fp16": 0.9799467325210571}, {"block_m": 8, "block_k": 128, "num_warps": 8, "avg_ms": 0.041332, "max_abs_diff_vs_current_w4": 0.0, "min_cosine_vs_fp16": 0.9799467325210571}, {"block_m": 8, "block_k": 256, "num_warps": 1, "avg_ms": 0.041308, "max_abs_diff_vs_current_w4": 0.0, "min_cosine_vs_fp16": 0.9799467325210571}, {"block_m": 8, "block_k": 256, "num_warps": 2, "avg_ms": 0.042403, "max_abs_diff_vs_current_w4": 0.0, "min_cosine_vs_fp16": 0.9799467325210571}, {"block_m": 8, "block_k": 256, "num_warps": 4, "avg_ms": 0.043066, "max_abs_diff_vs_current_w4": 0.0, "min_cosine_vs_fp16": 0.9799467325210571}, {"block_m": 8, "block_k": 256, "num_warps": 8, "avg_ms": 0.041445, "max_abs_diff_vs_current_w4": 5.960464477539063e-08, "min_cosine_vs_fp16": 0.9799467325210571}, {"block_m": 16, "block_k": 32, "num_warps": 1, "avg_ms": 0.040086, "max_abs_diff_vs_current_w4": 0.0, "min_cosine_vs_fp16": 0.9799467325210571}, {"block_m": 16, "block_k": 32, "num_warps": 2, "avg_ms": 0.042767, "max_abs_diff_vs_current_w4": 0.0, "min_cosine_vs_fp16": 0.9799467325210571}, {"block_m": 16, "block_k": 32, "num_warps": 4, "avg_ms": 0.041367, "max_abs_diff_vs_current_w4": 0.0, "min_cosine_vs_fp16": 0.9799467325210571}, {"block_m": 16, "block_k": 32, "num_warps": 8, "avg_ms": 0.039662, "max_abs_diff_vs_current_w4": 0.0, "min_cosine_vs_fp16": 0.9799467325210571}, {"block_m": 16, "block_k": 64, "num_warps": 1, "avg_ms": 0.039706, "max_abs_diff_vs_current_w4": 0.0, "min_cosine_vs_fp16": 0.9799467325210571}, {"block_m": 16, "block_k": 64, "num_warps": 2, "avg_ms": 0.041196, "max_abs_diff_vs_current_w4": 0.0, "min_cosine_vs_fp16": 0.9799467325210571}, {"block_m": 16, "block_k": 64, "num_warps": 4, "avg_ms": 0.042785, "max_abs_diff_vs_current_w4": 0.0, "min_cosine_vs_fp16": 0.9799467325210571}, {"block_m": 16, "block_k": 64, "num_warps": 8, "avg_ms": 0.041113, "max_abs_diff_vs_current_w4": 0.0, "min_cosine_vs_fp16": 0.9799467325210571}, {"block_m": 16, "block_k": 128, "num_warps": 1, "avg_ms": 0.042168, "max_abs_diff_vs_current_w4": 0.0, "min_cosine_vs_fp16": 0.9799467325210571}, {"block_m": 16, "block_k": 128, "num_warps": 2, "avg_ms": 0.042118, "max_abs_diff_vs_current_w4": 0.0, "min_cosine_vs_fp16": 0.9799467325210571}, {"block_m": 16, "block_k": 128, "num_warps": 4, "avg_ms": 0.039729, "max_abs_diff_vs_current_w4": 0.0, "min_cosine_vs_fp16": 0.9799467325210571}, {"block_m": 16, "block_k": 128, "num_warps": 8, "avg_ms": 0.04283, "max_abs_diff_vs_current_w4": 0.0, "min_cosine_vs_fp16": 0.9799467325210571}, {"block_m": 16, "block_k": 256, "num_warps": 1, "avg_ms": 0.041971, "max_abs_diff_vs_current_w4": 0.0, "min_cosine_vs_fp16": 0.9799467325210571}, {"block_m": 16, "block_k": 256, "num_warps": 2, "avg_ms": 0.043488, "max_abs_diff_vs_current_w4": 0.0, "min_cosine_vs_fp16": 0.9799467325210571}, {"block_m": 16, "block_k": 256, "num_warps": 4, "avg_ms": 0.042237, "max_abs_diff_vs_current_w4": 0.0, "min_cosine_vs_fp16": 0.9799467325210571}, {"block_m": 16, "block_k": 256, "num_warps": 8, "avg_ms": 0.04364, "max_abs_diff_vs_current_w4": 0.0, "min_cosine_vs_fp16": 0.9799467325210571}, {"block_m": 32, "block_k": 32, "num_warps": 1, "avg_ms": 0.043769, "max_abs_diff_vs_current_w4": 0.0, "min_cosine_vs_fp16": 0.9799467325210571}, {"block_m": 32, "block_k": 32, "num_warps": 2, "avg_ms": 0.040502, "max_abs_diff_vs_current_w4": 0.0, "min_cosine_vs_fp16": 0.9799467325210571}, {"block_m": 32, "block_k": 32, "num_warps": 4, "avg_ms": 0.041815, "max_abs_diff_vs_current_w4": 0.0, "min_cosine_vs_fp16": 0.9799467325210571}, {"block_m": 32, "block_k": 32, "num_warps": 8, "avg_ms": 0.042384, "max_abs_diff_vs_current_w4": 0.0, "min_cosine_vs_fp16": 0.9799467325210571}, {"block_m": 32, "block_k": 64, "num_warps": 1, "avg_ms": 0.041682, "max_abs_diff_vs_current_w4": 0.0, "min_cosine_vs_fp16": 0.9799467325210571}, {"block_m": 32, "block_k": 64, "num_warps": 2, "avg_ms": 0.042188, "max_abs_diff_vs_current_w4": 0.0, "min_cosine_vs_fp16": 0.9799467325210571}, {"block_m": 32, "block_k": 64, "num_warps": 4, "avg_ms": 0.041781, "max_abs_diff_vs_current_w4": 0.0, "min_cosine_vs_fp16": 0.9799467325210571}, {"block_m": 32, "block_k": 64, "num_warps": 8, "avg_ms": 0.041861, "max_abs_diff_vs_current_w4": 0.0, "min_cosine_vs_fp16": 0.9799467325210571}, {"block_m": 32, "block_k": 128, "num_warps": 1, "avg_ms": 0.042707, "max_abs_diff_vs_current_w4": 0.0, "min_cosine_vs_fp16": 0.9799467325210571}, {"block_m": 32, "block_k": 128, "num_warps": 2, "avg_ms": 0.041934, "max_abs_diff_vs_current_w4": 0.0, "min_cosine_vs_fp16": 0.9799467325210571}, {"block_m": 32, "block_k": 128, "num_warps": 4, "avg_ms": 0.043327, "max_abs_diff_vs_current_w4": 0.0, "min_cosine_vs_fp16": 0.9799467325210571}, {"block_m": 32, "block_k": 128, "num_warps": 8, "avg_ms": 0.041004, "max_abs_diff_vs_current_w4": 0.0, "min_cosine_vs_fp16": 0.9799467325210571}, {"block_m": 32, "block_k": 256, "num_warps": 1, "avg_ms": 0.045355, "max_abs_diff_vs_current_w4": 0.0, "min_cosine_vs_fp16": 0.9799467325210571}, {"block_m": 32, "block_k": 256, "num_warps": 2, "avg_ms": 0.041204, "max_abs_diff_vs_current_w4": 0.0, "min_cosine_vs_fp16": 0.9799467325210571}, {"block_m": 32, "block_k": 256, "num_warps": 4, "avg_ms": 0.043546, "max_abs_diff_vs_current_w4": 0.0, "min_cosine_vs_fp16": 0.9799467325210571}, {"block_m": 32, "block_k": 256, "num_warps": 8, "avg_ms": 0.041626, "max_abs_diff_vs_current_w4": 0.0, "min_cosine_vs_fp16": 0.9799467325210571}, {"block_m": 64, "block_k": 32, "num_warps": 1, "avg_ms": 0.041717, "max_abs_diff_vs_current_w4": 0.0, "min_cosine_vs_fp16": 0.9799467325210571}, {"block_m": 64, "block_k": 32, "num_warps": 2, "avg_ms": 0.039239, "max_abs_diff_vs_current_w4": 0.0, "min_cosine_vs_fp16": 0.9799467325210571}, {"block_m": 64, "block_k": 32, "num_warps": 4, "avg_ms": 0.042215, "max_abs_diff_vs_current_w4": 0.0, "min_cosine_vs_fp16": 0.9799467325210571}, {"block_m": 64, "block_k": 32, "num_warps": 8, "avg_ms": 0.060785, "max_abs_diff_vs_current_w4": 0.0, "min_cosine_vs_fp16": 0.9799467325210571}, {"block_m": 64, "block_k": 64, "num_warps": 1, "avg_ms": 0.040036, "max_abs_diff_vs_current_w4": 0.0, "min_cosine_vs_fp16": 0.9799467325210571}, {"block_m": 64, "block_k": 64, "num_warps": 2, "avg_ms": 0.042304, "max_abs_diff_vs_current_w4": 0.0, "min_cosine_vs_fp16": 0.9799467325210571}, {"block_m": 64, "block_k": 64, "num_warps": 4, "avg_ms": 0.046507, "max_abs_diff_vs_current_w4": 0.0, "min_cosine_vs_fp16": 0.9799467325210571}, {"block_m": 64, "block_k": 64, "num_warps": 8, "avg_ms": 0.042998, "max_abs_diff_vs_current_w4": 0.0, "min_cosine_vs_fp16": 0.9799467325210571}, {"block_m": 64, "block_k": 128, "num_warps": 1, "avg_ms": 0.040908, "max_abs_diff_vs_current_w4": 0.0, "min_cosine_vs_fp16": 0.9799467325210571}, {"block_m": 64, "block_k": 128, "num_warps": 2, "avg_ms": 0.041876, "max_abs_diff_vs_current_w4": 0.0, "min_cosine_vs_fp16": 0.9799467325210571}, {"block_m": 64, "block_k": 128, "num_warps": 4, "avg_ms": 0.045698, "max_abs_diff_vs_current_w4": 0.0, "min_cosine_vs_fp16": 0.9799467325210571}, {"block_m": 64, "block_k": 128, "num_warps": 8, "avg_ms": 0.040711, "max_abs_diff_vs_current_w4": 0.0, "min_cosine_vs_fp16": 0.9799467325210571}, {"block_m": 64, "block_k": 256, "num_warps": 1, "avg_ms": 0.085337, "max_abs_diff_vs_current_w4": 0.0, "min_cosine_vs_fp16": 0.9799467325210571}, {"block_m": 64, "block_k": 256, "num_warps": 2, "avg_ms": 0.041146, "max_abs_diff_vs_current_w4": 0.0, "min_cosine_vs_fp16": 0.9799467325210571}, {"block_m": 64, "block_k": 256, "num_warps": 4, "avg_ms": 0.040796, "max_abs_diff_vs_current_w4": 0.0, "min_cosine_vs_fp16": 0.9799467325210571}, {"block_m": 64, "block_k": 256, "num_warps": 8, "avg_ms": 0.042433, "max_abs_diff_vs_current_w4": 0.0, "min_cosine_vs_fp16": 0.9799467325210571}], "peak_vram_mb": 887.0}
{"axis": "kernelbench_mega_w4a16_rkv", "backend": "hf_adapter", "status": "pass", "candidate_backend": "triton_int4_projection_axis_rkv", "device": "NVIDIA GeForce RTX 4090", "dtype": "fp16", "batch_size": 4, "hidden_size": 1024, "layers": [0, 1, 11], "warmup": 16, "steps": 512, "avg_fp16_ms": 0.038402, "best_current_fused": {"block_m": 64, "block_k": 128, "num_warps": 4, "avg_ms": 0.066698, "min_cosine_vs_fp16": 0.9809207916259766}, "best_stacked_prepacked": {"block_m": 16, "block_k": 128, "num_warps": 4, "avg_ms": 0.038589, "max_abs_diff_vs_current_w4": 0.0, "min_cosine_vs_fp16": 0.9809207916259766}, "stacked_prepacked_speedup_vs_current": 1.7284, "stacked_prepacked_speedup_vs_fp16": 0.9952, "stacked_runtime_copy_ms": 0.055967, "stacked_runtime_copy_speedup_vs_current": 1.1917, "stacked_runtime_copy_speedup_vs_fp16": 0.6862, "packed_footprint_ratio_vs_fp16": 0.252, "kernel_launches": {"current_fused": 1, "stacked_prepacked": 1, "stacked_runtime_copy": 2}, "current_configs": [{"block_m": 8, "block_k": 32, "num_warps": 4, "avg_ms": 0.069887, "min_cosine_vs_fp16": 0.9809207916259766}, {"block_m": 8, "block_k": 64, "num_warps": 4, "avg_ms": 0.067344, "min_cosine_vs_fp16": 0.9809207916259766}, {"block_m": 8, "block_k": 128, "num_warps": 4, "avg_ms": 0.067979, "min_cosine_vs_fp16": 0.9809207916259766}, {"block_m": 8, "block_k": 256, "num_warps": 4, "avg_ms": 0.067873, "min_cosine_vs_fp16": 0.9809207916259766}, {"block_m": 16, "block_k": 32, "num_warps": 4, "avg_ms": 0.067739, "min_cosine_vs_fp16": 0.9809207916259766}, {"block_m": 16, "block_k": 64, "num_warps": 4, "avg_ms": 0.067286, "min_cosine_vs_fp16": 0.9809207916259766}, {"block_m": 16, "block_k": 128, "num_warps": 4, "avg_ms": 0.067683, "min_cosine_vs_fp16": 0.9809207916259766}, {"block_m": 16, "block_k": 256, "num_warps": 4, "avg_ms": 0.067493, "min_cosine_vs_fp16": 0.9809207916259766}, {"block_m": 32, "block_k": 32, "num_warps": 4, "avg_ms": 0.066999, "min_cosine_vs_fp16": 0.9809207916259766}, {"block_m": 32, "block_k": 64, "num_warps": 4, "avg_ms": 0.067886, "min_cosine_vs_fp16": 0.9809207916259766}, {"block_m": 32, "block_k": 128, "num_warps": 4, "avg_ms": 0.067125, "min_cosine_vs_fp16": 0.9809207916259766}, {"block_m": 32, "block_k": 256, "num_warps": 4, "avg_ms": 0.067047, "min_cosine_vs_fp16": 0.9809207916259766}, {"block_m": 64, "block_k": 32, "num_warps": 4, "avg_ms": 0.066711, "min_cosine_vs_fp16": 0.9809207916259766}, {"block_m": 64, "block_k": 64, "num_warps": 4, "avg_ms": 0.066865, "min_cosine_vs_fp16": 0.9809207916259766}, {"block_m": 64, "block_k": 128, "num_warps": 4, "avg_ms": 0.066698, "min_cosine_vs_fp16": 0.9809207916259766}, {"block_m": 64, "block_k": 256, "num_warps": 4, "avg_ms": 0.132974, "min_cosine_vs_fp16": 0.9809207916259766}], "stacked_configs": [{"block_m": 8, "block_k": 32, "num_warps": 1, "avg_ms": 0.041168, "max_abs_diff_vs_current_w4": 0.0, "min_cosine_vs_fp16": 0.9809207916259766}, {"block_m": 8, "block_k": 32, "num_warps": 2, "avg_ms": 0.042641, "max_abs_diff_vs_current_w4": 0.0, "min_cosine_vs_fp16": 0.9809207916259766}, {"block_m": 8, "block_k": 32, "num_warps": 4, "avg_ms": 0.041624, "max_abs_diff_vs_current_w4": 0.0, "min_cosine_vs_fp16": 0.9809207916259766}, {"block_m": 8, "block_k": 32, "num_warps": 8, "avg_ms": 0.040364, "max_abs_diff_vs_current_w4": 0.0, "min_cosine_vs_fp16": 0.9809207916259766}, {"block_m": 8, "block_k": 64, "num_warps": 1, "avg_ms": 0.039778, "max_abs_diff_vs_current_w4": 0.0, "min_cosine_vs_fp16": 0.9809207916259766}, {"block_m": 8, "block_k": 64, "num_warps": 2, "avg_ms": 0.039869, "max_abs_diff_vs_current_w4": 0.0, "min_cosine_vs_fp16": 0.9809207916259766}, {"block_m": 8, "block_k": 64, "num_warps": 4, "avg_ms": 0.040391, "max_abs_diff_vs_current_w4": 0.0, "min_cosine_vs_fp16": 0.9809207916259766}, {"block_m": 8, "block_k": 64, "num_warps": 8, "avg_ms": 0.04216, "max_abs_diff_vs_current_w4": 0.0, "min_cosine_vs_fp16": 0.9809207916259766}, {"block_m": 8, "block_k": 128, "num_warps": 1, "avg_ms": 0.041156, "max_abs_diff_vs_current_w4": 0.0, "min_cosine_vs_fp16": 0.9809207916259766}, {"block_m": 8, "block_k": 128, "num_warps": 2, "avg_ms": 0.040126, "max_abs_diff_vs_current_w4": 0.0, "min_cosine_vs_fp16": 0.9809207916259766}, {"block_m": 8, "block_k": 128, "num_warps": 4, "avg_ms": 0.039763, "max_abs_diff_vs_current_w4": 0.0, "min_cosine_vs_fp16": 0.9809207916259766}, {"block_m": 8, "block_k": 128, "num_warps": 8, "avg_ms": 0.040196, "max_abs_diff_vs_current_w4": 0.0, "min_cosine_vs_fp16": 0.9809207916259766}, {"block_m": 8, "block_k": 256, "num_warps": 1, "avg_ms": 0.038817, "max_abs_diff_vs_current_w4": 0.0, "min_cosine_vs_fp16": 0.9809207916259766}, {"block_m": 8, "block_k": 256, "num_warps": 2, "avg_ms": 0.042317, "max_abs_diff_vs_current_w4": 0.0, "min_cosine_vs_fp16": 0.9809207916259766}, {"block_m": 8, "block_k": 256, "num_warps": 4, "avg_ms": 0.040581, "max_abs_diff_vs_current_w4": 0.0, "min_cosine_vs_fp16": 0.9809207916259766}, {"block_m": 8, "block_k": 256, "num_warps": 8, "avg_ms": 0.041571, "max_abs_diff_vs_current_w4": 0.0, "min_cosine_vs_fp16": 0.9809207916259766}, {"block_m": 16, "block_k": 32, "num_warps": 1, "avg_ms": 0.040572, "max_abs_diff_vs_current_w4": 0.0, "min_cosine_vs_fp16": 0.9809207916259766}, {"block_m": 16, "block_k": 32, "num_warps": 2, "avg_ms": 0.040468, "max_abs_diff_vs_current_w4": 0.0, "min_cosine_vs_fp16": 0.9809207916259766}, {"block_m": 16, "block_k": 32, "num_warps": 4, "avg_ms": 0.047725, "max_abs_diff_vs_current_w4": 0.0, "min_cosine_vs_fp16": 0.9809207916259766}, {"block_m": 16, "block_k": 32, "num_warps": 8, "avg_ms": 0.039312, "max_abs_diff_vs_current_w4": 0.0, "min_cosine_vs_fp16": 0.9809207916259766}, {"block_m": 16, "block_k": 64, "num_warps": 1, "avg_ms": 0.039927, "max_abs_diff_vs_current_w4": 0.0, "min_cosine_vs_fp16": 0.9809207916259766}, {"block_m": 16, "block_k": 64, "num_warps": 2, "avg_ms": 0.041363, "max_abs_diff_vs_current_w4": 0.0, "min_cosine_vs_fp16": 0.9809207916259766}, {"block_m": 16, "block_k": 64, "num_warps": 4, "avg_ms": 0.041627, "max_abs_diff_vs_current_w4": 0.0, "min_cosine_vs_fp16": 0.9809207916259766}, {"block_m": 16, "block_k": 64, "num_warps": 8, "avg_ms": 0.042466, "max_abs_diff_vs_current_w4": 0.0, "min_cosine_vs_fp16": 0.9809207916259766}, {"block_m": 16, "block_k": 128, "num_warps": 1, "avg_ms": 0.041709, "max_abs_diff_vs_current_w4": 0.0, "min_cosine_vs_fp16": 0.9809207916259766}, {"block_m": 16, "block_k": 128, "num_warps": 2, "avg_ms": 0.04299, "max_abs_diff_vs_current_w4": 0.0, "min_cosine_vs_fp16": 0.9809207916259766}, {"block_m": 16, "block_k": 128, "num_warps": 4, "avg_ms": 0.038589, "max_abs_diff_vs_current_w4": 0.0, "min_cosine_vs_fp16": 0.9809207916259766}, {"block_m": 16, "block_k": 128, "num_warps": 8, "avg_ms": 0.040261, "max_abs_diff_vs_current_w4": 0.0, "min_cosine_vs_fp16": 0.9809207916259766}, {"block_m": 16, "block_k": 256, "num_warps": 1, "avg_ms": 0.040706, "max_abs_diff_vs_current_w4": 0.0, "min_cosine_vs_fp16": 0.9809207916259766}, {"block_m": 16, "block_k": 256, "num_warps": 2, "avg_ms": 0.040092, "max_abs_diff_vs_current_w4": 0.0, "min_cosine_vs_fp16": 0.9809207916259766}, {"block_m": 16, "block_k": 256, "num_warps": 4, "avg_ms": 0.040185, "max_abs_diff_vs_current_w4": 0.0, "min_cosine_vs_fp16": 0.9809207916259766}, {"block_m": 16, "block_k": 256, "num_warps": 8, "avg_ms": 0.040364, "max_abs_diff_vs_current_w4": 0.0, "min_cosine_vs_fp16": 0.9809207916259766}, {"block_m": 32, "block_k": 32, "num_warps": 1, "avg_ms": 0.03985, "max_abs_diff_vs_current_w4": 0.0, "min_cosine_vs_fp16": 0.9809207916259766}, {"block_m": 32, "block_k": 32, "num_warps": 2, "avg_ms": 0.042735, "max_abs_diff_vs_current_w4": 0.0, "min_cosine_vs_fp16": 0.9809207916259766}, {"block_m": 32, "block_k": 32, "num_warps": 4, "avg_ms": 0.041408, "max_abs_diff_vs_current_w4": 0.0, "min_cosine_vs_fp16": 0.9809207916259766}, {"block_m": 32, "block_k": 32, "num_warps": 8, "avg_ms": 0.040961, "max_abs_diff_vs_current_w4": 0.0, "min_cosine_vs_fp16": 0.9809207916259766}, {"block_m": 32, "block_k": 64, "num_warps": 1, "avg_ms": 0.040473, "max_abs_diff_vs_current_w4": 0.0, "min_cosine_vs_fp16": 0.9809207916259766}, {"block_m": 32, "block_k": 64, "num_warps": 2, "avg_ms": 0.041175, "max_abs_diff_vs_current_w4": 0.0, "min_cosine_vs_fp16": 0.9809207916259766}, {"block_m": 32, "block_k": 64, "num_warps": 4, "avg_ms": 0.04226, "max_abs_diff_vs_current_w4": 0.0, "min_cosine_vs_fp16": 0.9809207916259766}, {"block_m": 32, "block_k": 64, "num_warps": 8, "avg_ms": 0.042745, "max_abs_diff_vs_current_w4": 0.0, "min_cosine_vs_fp16": 0.9809207916259766}, {"block_m": 32, "block_k": 128, "num_warps": 1, "avg_ms": 0.041638, "max_abs_diff_vs_current_w4": 0.0, "min_cosine_vs_fp16": 0.9809207916259766}, {"block_m": 32, "block_k": 128, "num_warps": 2, "avg_ms": 0.039884, "max_abs_diff_vs_current_w4": 0.0, "min_cosine_vs_fp16": 0.9809207916259766}, {"block_m": 32, "block_k": 128, "num_warps": 4, "avg_ms": 0.041052, "max_abs_diff_vs_current_w4": 0.0, "min_cosine_vs_fp16": 0.9809207916259766}, {"block_m": 32, "block_k": 128, "num_warps": 8, "avg_ms": 0.038665, "max_abs_diff_vs_current_w4": 0.0, "min_cosine_vs_fp16": 0.9809207916259766}, {"block_m": 32, "block_k": 256, "num_warps": 1, "avg_ms": 0.041905, "max_abs_diff_vs_current_w4": 0.0, "min_cosine_vs_fp16": 0.9809207916259766}, {"block_m": 32, "block_k": 256, "num_warps": 2, "avg_ms": 0.04042, "max_abs_diff_vs_current_w4": 0.0, "min_cosine_vs_fp16": 0.9809207916259766}, {"block_m": 32, "block_k": 256, "num_warps": 4, "avg_ms": 0.040223, "max_abs_diff_vs_current_w4": 0.0, "min_cosine_vs_fp16": 0.9809207916259766}, {"block_m": 32, "block_k": 256, "num_warps": 8, "avg_ms": 0.040828, "max_abs_diff_vs_current_w4": 0.0, "min_cosine_vs_fp16": 0.9809207916259766}, {"block_m": 64, "block_k": 32, "num_warps": 1, "avg_ms": 0.04088, "max_abs_diff_vs_current_w4": 0.0, "min_cosine_vs_fp16": 0.9809207916259766}, {"block_m": 64, "block_k": 32, "num_warps": 2, "avg_ms": 0.041972, "max_abs_diff_vs_current_w4": 0.0, "min_cosine_vs_fp16": 0.9809207916259766}, {"block_m": 64, "block_k": 32, "num_warps": 4, "avg_ms": 0.040307, "max_abs_diff_vs_current_w4": 0.0, "min_cosine_vs_fp16": 0.9809207916259766}, {"block_m": 64, "block_k": 32, "num_warps": 8, "avg_ms": 0.041312, "max_abs_diff_vs_current_w4": 0.0, "min_cosine_vs_fp16": 0.9809207916259766}, {"block_m": 64, "block_k": 64, "num_warps": 1, "avg_ms": 0.04125, "max_abs_diff_vs_current_w4": 0.0, "min_cosine_vs_fp16": 0.9809207916259766}, {"block_m": 64, "block_k": 64, "num_warps": 2, "avg_ms": 0.041217, "max_abs_diff_vs_current_w4": 0.0, "min_cosine_vs_fp16": 0.9809207916259766}, {"block_m": 64, "block_k": 64, "num_warps": 4, "avg_ms": 0.041899, "max_abs_diff_vs_current_w4": 0.0, "min_cosine_vs_fp16": 0.9809207916259766}, {"block_m": 64, "block_k": 64, "num_warps": 8, "avg_ms": 0.04005, "max_abs_diff_vs_current_w4": 0.0, "min_cosine_vs_fp16": 0.9809207916259766}, {"block_m": 64, "block_k": 128, "num_warps": 1, "avg_ms": 0.040486, "max_abs_diff_vs_current_w4": 0.0, "min_cosine_vs_fp16": 0.9809207916259766}, {"block_m": 64, "block_k": 128, "num_warps": 2, "avg_ms": 0.047852, "max_abs_diff_vs_current_w4": 0.0, "min_cosine_vs_fp16": 0.9809207916259766}, {"block_m": 64, "block_k": 128, "num_warps": 4, "avg_ms": 0.039767, "max_abs_diff_vs_current_w4": 0.0, "min_cosine_vs_fp16": 0.9809207916259766}, {"block_m": 64, "block_k": 128, "num_warps": 8, "avg_ms": 0.040923, "max_abs_diff_vs_current_w4": 0.0, "min_cosine_vs_fp16": 0.9809207916259766}, {"block_m": 64, "block_k": 256, "num_warps": 1, "avg_ms": 0.125823, "max_abs_diff_vs_current_w4": 0.0, "min_cosine_vs_fp16": 0.9809207916259766}, {"block_m": 64, "block_k": 256, "num_warps": 2, "avg_ms": 0.040562, "max_abs_diff_vs_current_w4": 0.0, "min_cosine_vs_fp16": 0.9809207916259766}, {"block_m": 64, "block_k": 256, "num_warps": 4, "avg_ms": 0.040053, "max_abs_diff_vs_current_w4": 0.0, "min_cosine_vs_fp16": 0.9809207916259766}, {"block_m": 64, "block_k": 256, "num_warps": 8, "avg_ms": 0.042102, "max_abs_diff_vs_current_w4": 0.0, "min_cosine_vs_fp16": 0.9809207916259766}], "peak_vram_mb": 887.0}
{"axis": "kernelbench_mega_w4a16_rkv", "backend": "hf_adapter", "status": "pass", "candidate_backend": "triton_int4_projection_axis_rkv", "device": "NVIDIA GeForce RTX 4090", "dtype": "fp16", "batch_size": 8, "hidden_size": 1024, "layers": [0, 1, 11], "warmup": 16, "steps": 512, "avg_fp16_ms": 0.039452, "best_current_fused": {"block_m": 32, "block_k": 32, "num_warps": 4, "avg_ms": 0.067464, "min_cosine_vs_fp16": 0.9800536036491394}, "best_stacked_prepacked": {"block_m": 16, "block_k": 128, "num_warps": 2, "avg_ms": 0.03888, "max_abs_diff_vs_current_w4": 0.0, "min_cosine_vs_fp16": 0.9800536036491394}, "stacked_prepacked_speedup_vs_current": 1.7352, "stacked_prepacked_speedup_vs_fp16": 1.0147, "stacked_runtime_copy_ms": 0.054673, "stacked_runtime_copy_speedup_vs_current": 1.234, "stacked_runtime_copy_speedup_vs_fp16": 0.7216, "packed_footprint_ratio_vs_fp16": 0.252, "kernel_launches": {"current_fused": 1, "stacked_prepacked": 1, "stacked_runtime_copy": 2}, "current_configs": [{"block_m": 8, "block_k": 32, "num_warps": 4, "avg_ms": 0.071368, "min_cosine_vs_fp16": 0.9800536036491394}, {"block_m": 8, "block_k": 64, "num_warps": 4, "avg_ms": 0.068639, "min_cosine_vs_fp16": 0.9800536036491394}, {"block_m": 8, "block_k": 128, "num_warps": 4, "avg_ms": 0.067999, "min_cosine_vs_fp16": 0.9800536036491394}, {"block_m": 8, "block_k": 256, "num_warps": 4, "avg_ms": 0.067767, "min_cosine_vs_fp16": 0.9800536036491394}, {"block_m": 16, "block_k": 32, "num_warps": 4, "avg_ms": 0.069373, "min_cosine_vs_fp16": 0.9800536036491394}, {"block_m": 16, "block_k": 64, "num_warps": 4, "avg_ms": 0.067713, "min_cosine_vs_fp16": 0.9800536036491394}, {"block_m": 16, "block_k": 128, "num_warps": 4, "avg_ms": 0.06777, "min_cosine_vs_fp16": 0.9800536036491394}, {"block_m": 16, "block_k": 256, "num_warps": 4, "avg_ms": 0.067683, "min_cosine_vs_fp16": 0.9800536036491394}, {"block_m": 32, "block_k": 32, "num_warps": 4, "avg_ms": 0.067464, "min_cosine_vs_fp16": 0.9800536036491394}, {"block_m": 32, "block_k": 64, "num_warps": 4, "avg_ms": 0.069535, "min_cosine_vs_fp16": 0.9800536036491394}, {"block_m": 32, "block_k": 128, "num_warps": 4, "avg_ms": 0.068277, "min_cosine_vs_fp16": 0.9800536036491394}, {"block_m": 32, "block_k": 256, "num_warps": 4, "avg_ms": 0.067918, "min_cosine_vs_fp16": 0.9800536036491394}, {"block_m": 64, "block_k": 32, "num_warps": 4, "avg_ms": 0.068631, "min_cosine_vs_fp16": 0.9800536036491394}, {"block_m": 64, "block_k": 64, "num_warps": 4, "avg_ms": 0.068632, "min_cosine_vs_fp16": 0.9800536036491394}, {"block_m": 64, "block_k": 128, "num_warps": 4, "avg_ms": 0.06812, "min_cosine_vs_fp16": 0.9800536036491394}, {"block_m": 64, "block_k": 256, "num_warps": 4, "avg_ms": 0.357123, "min_cosine_vs_fp16": 0.9800536036491394}], "stacked_configs": [{"block_m": 8, "block_k": 32, "num_warps": 1, "avg_ms": 0.042388, "max_abs_diff_vs_current_w4": 0.0, "min_cosine_vs_fp16": 0.9800536036491394}, {"block_m": 8, "block_k": 32, "num_warps": 2, "avg_ms": 0.04176, "max_abs_diff_vs_current_w4": 0.0, "min_cosine_vs_fp16": 0.9800536036491394}, {"block_m": 8, "block_k": 32, "num_warps": 4, "avg_ms": 0.041138, "max_abs_diff_vs_current_w4": 0.0, "min_cosine_vs_fp16": 0.9800536036491394}, {"block_m": 8, "block_k": 32, "num_warps": 8, "avg_ms": 0.041058, "max_abs_diff_vs_current_w4": 0.0, "min_cosine_vs_fp16": 0.9800536036491394}, {"block_m": 8, "block_k": 64, "num_warps": 1, "avg_ms": 0.041622, "max_abs_diff_vs_current_w4": 0.0, "min_cosine_vs_fp16": 0.9800536036491394}, {"block_m": 8, "block_k": 64, "num_warps": 2, "avg_ms": 0.04129, "max_abs_diff_vs_current_w4": 0.0, "min_cosine_vs_fp16": 0.9800536036491394}, {"block_m": 8, "block_k": 64, "num_warps": 4, "avg_ms": 0.042226, "max_abs_diff_vs_current_w4": 0.0, "min_cosine_vs_fp16": 0.9800536036491394}, {"block_m": 8, "block_k": 64, "num_warps": 8, "avg_ms": 0.039382, "max_abs_diff_vs_current_w4": 0.0, "min_cosine_vs_fp16": 0.9800536036491394}, {"block_m": 8, "block_k": 128, "num_warps": 1, "avg_ms": 0.040721, "max_abs_diff_vs_current_w4": 0.0, "min_cosine_vs_fp16": 0.9800536036491394}, {"block_m": 8, "block_k": 128, "num_warps": 2, "avg_ms": 0.041307, "max_abs_diff_vs_current_w4": 0.0, "min_cosine_vs_fp16": 0.9800536036491394}, {"block_m": 8, "block_k": 128, "num_warps": 4, "avg_ms": 0.04274, "max_abs_diff_vs_current_w4": 0.0, "min_cosine_vs_fp16": 0.9800536036491394}, {"block_m": 8, "block_k": 128, "num_warps": 8, "avg_ms": 0.040785, "max_abs_diff_vs_current_w4": 0.0, "min_cosine_vs_fp16": 0.9800536036491394}, {"block_m": 8, "block_k": 256, "num_warps": 1, "avg_ms": 0.040983, "max_abs_diff_vs_current_w4": 0.0, "min_cosine_vs_fp16": 0.9800536036491394}, {"block_m": 8, "block_k": 256, "num_warps": 2, "avg_ms": 0.041315, "max_abs_diff_vs_current_w4": 0.0, "min_cosine_vs_fp16": 0.9800536036491394}, {"block_m": 8, "block_k": 256, "num_warps": 4, "avg_ms": 0.039747, "max_abs_diff_vs_current_w4": 0.0, "min_cosine_vs_fp16": 0.9800536036491394}, {"block_m": 8, "block_k": 256, "num_warps": 8, "avg_ms": 0.039963, "max_abs_diff_vs_current_w4": 9.5367431640625e-07, "min_cosine_vs_fp16": 0.9800536036491394}, {"block_m": 16, "block_k": 32, "num_warps": 1, "avg_ms": 0.040947, "max_abs_diff_vs_current_w4": 0.0, "min_cosine_vs_fp16": 0.9800536036491394}, {"block_m": 16, "block_k": 32, "num_warps": 2, "avg_ms": 0.039715, "max_abs_diff_vs_current_w4": 0.0, "min_cosine_vs_fp16": 0.9800536036491394}, {"block_m": 16, "block_k": 32, "num_warps": 4, "avg_ms": 0.043158, "max_abs_diff_vs_current_w4": 0.0, "min_cosine_vs_fp16": 0.9800536036491394}, {"block_m": 16, "block_k": 32, "num_warps": 8, "avg_ms": 0.041578, "max_abs_diff_vs_current_w4": 0.0, "min_cosine_vs_fp16": 0.9800536036491394}, {"block_m": 16, "block_k": 64, "num_warps": 1, "avg_ms": 0.042468, "max_abs_diff_vs_current_w4": 0.0, "min_cosine_vs_fp16": 0.9800536036491394}, {"block_m": 16, "block_k": 64, "num_warps": 2, "avg_ms": 0.040688, "max_abs_diff_vs_current_w4": 0.0, "min_cosine_vs_fp16": 0.9800536036491394}, {"block_m": 16, "block_k": 64, "num_warps": 4, "avg_ms": 0.042352, "max_abs_diff_vs_current_w4": 0.0, "min_cosine_vs_fp16": 0.9800536036491394}, {"block_m": 16, "block_k": 64, "num_warps": 8, "avg_ms": 0.039084, "max_abs_diff_vs_current_w4": 0.0, "min_cosine_vs_fp16": 0.9800536036491394}, {"block_m": 16, "block_k": 128, "num_warps": 1, "avg_ms": 0.041554, "max_abs_diff_vs_current_w4": 0.0, "min_cosine_vs_fp16": 0.9800536036491394}, {"block_m": 16, "block_k": 128, "num_warps": 2, "avg_ms": 0.03888, "max_abs_diff_vs_current_w4": 0.0, "min_cosine_vs_fp16": 0.9800536036491394}, {"block_m": 16, "block_k": 128, "num_warps": 4, "avg_ms": 0.040488, "max_abs_diff_vs_current_w4": 0.0, "min_cosine_vs_fp16": 0.9800536036491394}, {"block_m": 16, "block_k": 128, "num_warps": 8, "avg_ms": 0.04027, "max_abs_diff_vs_current_w4": 0.0, "min_cosine_vs_fp16": 0.9800536036491394}, {"block_m": 16, "block_k": 256, "num_warps": 1, "avg_ms": 0.040685, "max_abs_diff_vs_current_w4": 0.0, "min_cosine_vs_fp16": 0.9800536036491394}, {"block_m": 16, "block_k": 256, "num_warps": 2, "avg_ms": 0.042188, "max_abs_diff_vs_current_w4": 0.0, "min_cosine_vs_fp16": 0.9800536036491394}, {"block_m": 16, "block_k": 256, "num_warps": 4, "avg_ms": 0.040588, "max_abs_diff_vs_current_w4": 0.0, "min_cosine_vs_fp16": 0.9800536036491394}, {"block_m": 16, "block_k": 256, "num_warps": 8, "avg_ms": 0.041192, "max_abs_diff_vs_current_w4": 0.0, "min_cosine_vs_fp16": 0.9800536036491394}, {"block_m": 32, "block_k": 32, "num_warps": 1, "avg_ms": 0.04153, "max_abs_diff_vs_current_w4": 0.0, "min_cosine_vs_fp16": 0.9800536036491394}, {"block_m": 32, "block_k": 32, "num_warps": 2, "avg_ms": 0.039277, "max_abs_diff_vs_current_w4": 0.0, "min_cosine_vs_fp16": 0.9800536036491394}, {"block_m": 32, "block_k": 32, "num_warps": 4, "avg_ms": 0.041687, "max_abs_diff_vs_current_w4": 0.0, "min_cosine_vs_fp16": 0.9800536036491394}, {"block_m": 32, "block_k": 32, "num_warps": 8, "avg_ms": 0.040708, "max_abs_diff_vs_current_w4": 0.0, "min_cosine_vs_fp16": 0.9800536036491394}, {"block_m": 32, "block_k": 64, "num_warps": 1, "avg_ms": 0.041268, "max_abs_diff_vs_current_w4": 0.0, "min_cosine_vs_fp16": 0.9800536036491394}, {"block_m": 32, "block_k": 64, "num_warps": 2, "avg_ms": 0.041635, "max_abs_diff_vs_current_w4": 0.0, "min_cosine_vs_fp16": 0.9800536036491394}, {"block_m": 32, "block_k": 64, "num_warps": 4, "avg_ms": 0.04105, "max_abs_diff_vs_current_w4": 0.0, "min_cosine_vs_fp16": 0.9800536036491394}, {"block_m": 32, "block_k": 64, "num_warps": 8, "avg_ms": 0.042272, "max_abs_diff_vs_current_w4": 0.0, "min_cosine_vs_fp16": 0.9800536036491394}, {"block_m": 32, "block_k": 128, "num_warps": 1, "avg_ms": 0.043324, "max_abs_diff_vs_current_w4": 0.0, "min_cosine_vs_fp16": 0.9800536036491394}, {"block_m": 32, "block_k": 128, "num_warps": 2, "avg_ms": 0.041745, "max_abs_diff_vs_current_w4": 0.0, "min_cosine_vs_fp16": 0.9800536036491394}, {"block_m": 32, "block_k": 128, "num_warps": 4, "avg_ms": 0.041349, "max_abs_diff_vs_current_w4": 0.0, "min_cosine_vs_fp16": 0.9800536036491394}, {"block_m": 32, "block_k": 128, "num_warps": 8, "avg_ms": 0.041139, "max_abs_diff_vs_current_w4": 0.0, "min_cosine_vs_fp16": 0.9800536036491394}, {"block_m": 32, "block_k": 256, "num_warps": 1, "avg_ms": 0.041304, "max_abs_diff_vs_current_w4": 0.0, "min_cosine_vs_fp16": 0.9800536036491394}, {"block_m": 32, "block_k": 256, "num_warps": 2, "avg_ms": 0.04161, "max_abs_diff_vs_current_w4": 0.0, "min_cosine_vs_fp16": 0.9800536036491394}, {"block_m": 32, "block_k": 256, "num_warps": 4, "avg_ms": 0.041104, "max_abs_diff_vs_current_w4": 0.0, "min_cosine_vs_fp16": 0.9800536036491394}, {"block_m": 32, "block_k": 256, "num_warps": 8, "avg_ms": 0.040912, "max_abs_diff_vs_current_w4": 0.0, "min_cosine_vs_fp16": 0.9800536036491394}, {"block_m": 64, "block_k": 32, "num_warps": 1, "avg_ms": 0.04078, "max_abs_diff_vs_current_w4": 0.0, "min_cosine_vs_fp16": 0.9800536036491394}, {"block_m": 64, "block_k": 32, "num_warps": 2, "avg_ms": 0.039585, "max_abs_diff_vs_current_w4": 0.0, "min_cosine_vs_fp16": 0.9800536036491394}, {"block_m": 64, "block_k": 32, "num_warps": 4, "avg_ms": 0.041165, "max_abs_diff_vs_current_w4": 0.0, "min_cosine_vs_fp16": 0.9800536036491394}, {"block_m": 64, "block_k": 32, "num_warps": 8, "avg_ms": 0.040326, "max_abs_diff_vs_current_w4": 0.0, "min_cosine_vs_fp16": 0.9800536036491394}, {"block_m": 64, "block_k": 64, "num_warps": 1, "avg_ms": 0.040692, "max_abs_diff_vs_current_w4": 0.0, "min_cosine_vs_fp16": 0.9800536036491394}, {"block_m": 64, "block_k": 64, "num_warps": 2, "avg_ms": 0.042776, "max_abs_diff_vs_current_w4": 0.0, "min_cosine_vs_fp16": 0.9800536036491394}, {"block_m": 64, "block_k": 64, "num_warps": 4, "avg_ms": 0.043002, "max_abs_diff_vs_current_w4": 0.0, "min_cosine_vs_fp16": 0.9800536036491394}, {"block_m": 64, "block_k": 64, "num_warps": 8, "avg_ms": 0.041156, "max_abs_diff_vs_current_w4": 0.0, "min_cosine_vs_fp16": 0.9800536036491394}, {"block_m": 64, "block_k": 128, "num_warps": 1, "avg_ms": 0.039155, "max_abs_diff_vs_current_w4": 0.0, "min_cosine_vs_fp16": 0.9800536036491394}, {"block_m": 64, "block_k": 128, "num_warps": 2, "avg_ms": 0.040781, "max_abs_diff_vs_current_w4": 0.0, "min_cosine_vs_fp16": 0.9800536036491394}, {"block_m": 64, "block_k": 128, "num_warps": 4, "avg_ms": 0.042485, "max_abs_diff_vs_current_w4": 0.0, "min_cosine_vs_fp16": 0.9800536036491394}, {"block_m": 64, "block_k": 128, "num_warps": 8, "avg_ms": 0.041145, "max_abs_diff_vs_current_w4": 0.0, "min_cosine_vs_fp16": 0.9800536036491394}, {"block_m": 64, "block_k": 256, "num_warps": 1, "avg_ms": 0.351395, "max_abs_diff_vs_current_w4": 0.0, "min_cosine_vs_fp16": 0.9800536036491394}, {"block_m": 64, "block_k": 256, "num_warps": 2, "avg_ms": 0.040199, "max_abs_diff_vs_current_w4": 0.0, "min_cosine_vs_fp16": 0.9800536036491394}, {"block_m": 64, "block_k": 256, "num_warps": 4, "avg_ms": 0.043129, "max_abs_diff_vs_current_w4": 0.0, "min_cosine_vs_fp16": 0.9800536036491394}, {"block_m": 64, "block_k": 256, "num_warps": 8, "avg_ms": 0.041064, "max_abs_diff_vs_current_w4": 0.0, "min_cosine_vs_fp16": 0.9800536036491394}], "peak_vram_mb": 887.1}
